<?xml version="1.0" encoding="UTF-8"?>
<simulation xmlns:xsi="http://www.w3.org/2001/XMLSchema-instance"
            xsi:noNamespaceSchemaLocation="../src/IO/Input/schema.xsd">
    <output>
        <baseName>XYZ</baseName>
        <writeFrequency>10</writeFrequency>
    </output>
    <calculator>
        <calculatorForce>LJC</calculatorForce>
    </calculator>
    <parameters>
        <tEnd>3.0</tEnd>
        <deltaT>0.0001</deltaT>
    </parameters>
    <shapes>
        <particle>
            <position>
                <x>1.0</x>
                <y>2.0</y>
                <z>3.0</z>
            </position>
            <velocity>
                <x>0.0</x>
                <y>1.0</y>
                <z>0.0</z>
            </velocity>
            <mass>5.0</mass>
        </particle>
    </shapes>
</simulation>

